{
  "events_spec": [
    { "name": "page_view", "trigger": "Every route mount", "params": [{ "name": "page_location", "type": "string", "required": true }, { "name": "page_title", "type": "string", "required": true }], "destinations": ["dest_001", "dest_002"] },
    { "name": "view_item", "trigger": "PDP mount", "params": [{ "name": "item_id", "type": "string", "required": true }, { "name": "item_name", "type": "string", "required": true }, { "name": "price", "type": "number", "required": true }, { "name": "currency", "type": "string", "required": true }], "destinations": ["dest_001", "dest_002", "dest_003"] },
    { "name": "add_to_cart", "trigger": "Add-to-cart button click", "params": [{ "name": "item_id", "type": "string", "required": true }, { "name": "quantity", "type": "number", "required": true }, { "name": "value", "type": "number", "required": true }], "destinations": ["dest_001", "dest_002", "dest_003"] },
    { "name": "begin_checkout", "trigger": "Checkout page mount", "params": [{ "name": "value", "type": "number", "required": true }, { "name": "items", "type": "array", "required": true }], "destinations": ["dest_001", "dest_002", "dest_003"] },
    { "name": "purchase", "trigger": "Order confirmation page (server-confirmed)", "params": [{ "name": "transaction_id", "type": "string", "required": true }, { "name": "value", "type": "number", "required": true }, { "name": "currency", "type": "string", "required": true }, { "name": "items", "type": "array", "required": true }, { "name": "customer_email_hash", "type": "string", "required": true, "pii": true }, { "name": "is_first_purchase", "type": "boolean", "required": true }], "destinations": ["dest_001", "dest_002", "dest_003", "dest_004"] },
    { "name": "email_signup", "trigger": "Newsletter form submit", "params": [{ "name": "source", "type": "string", "required": true }, { "name": "email_hash", "type": "string", "required": true, "pii": true }], "destinations": ["dest_004"] },
    { "name": "cart_abandoned", "trigger": "Idle 30 min on cart with items", "params": [{ "name": "value", "type": "number", "required": true }, { "name": "items", "type": "array", "required": true }, { "name": "email_hash", "type": "string", "required": false, "pii": true }], "destinations": ["dest_004"] },
    { "name": "email_unsubscribed", "trigger": "Unsubscribe link click (Phase 2 webhook)", "params": [{ "name": "email_hash", "type": "string", "required": true, "pii": true }, { "name": "list_id", "type": "string", "required": false }], "destinations": ["dest_004"] },
    { "name": "return_initiated", "trigger": "Customer submits return request (Phase 2)", "params": [{ "name": "order_id", "type": "string", "required": true }, { "name": "reason_code", "type": "string", "required": false }], "destinations": ["dest_004"] },
    { "name": "refund", "trigger": "Refund issued (Stripe webhook)", "params": [{ "name": "order_id", "type": "string", "required": true }, { "name": "amount", "type": "number", "required": true }, { "name": "currency", "type": "string", "required": true }], "destinations": ["dest_004"] },
    { "name": "order_shipped", "trigger": "Carrier tracking number created", "params": [{ "name": "order_id", "type": "string", "required": true }, { "name": "carrier", "type": "string", "required": true }, { "name": "tracking_number", "type": "string", "required": true }], "destinations": ["dest_004"] },
    { "name": "order_delivered", "trigger": "Carrier delivery confirmation webhook", "params": [{ "name": "order_id", "type": "string", "required": true }], "destinations": ["dest_004"] },
    { "name": "order_canceled", "trigger": "Order cancellation (admin or customer)", "params": [{ "name": "order_id", "type": "string", "required": true }, { "name": "reason_code", "type": "string", "required": false }], "destinations": ["dest_004"] }
  ],
  "destinations": [
    { "id": "dest_001", "type": "ga4", "scope": "Site analytics + ecom funnel", "container_id_placeholder": "G-XXXXXXXXXX" },
    { "id": "dest_002", "type": "meta_pixel", "scope": "Meta CAPI + browser pixel for retargeting & lookalike", "container_id_placeholder": "TBD" },
    { "id": "dest_003", "type": "tiktok_pixel", "scope": "TikTok Events API for retargeting", "container_id_placeholder": "TBD" },
    { "id": "dest_004", "type": "internal_db", "scope": "Phase 2 placeholder — feeds eec-10/eec-11 when those skills launch", "container_id_placeholder": "phase2_pending" }
  ],
  "consent_mode": {
    "framework": "gdpr",
    "regions": ["DE", "FR", "ES", "IT", "NL", "PL", "GB", "IE", "CA"],
    "defaults": {
      "ad_storage": "denied",
      "analytics_storage": "denied",
      "ad_user_data": "denied",
      "ad_personalization": "denied",
      "functionality_storage": "granted"
    },
    "required_categories": ["analytics", "ad_storage", "ad_user_data", "ad_personalization"]
  },
  "utm_taxonomy": {
    "source_format": "lower_snake; one of meta|google|tiktok|email|organic|partner",
    "medium_format": "lower_snake; one of paid_social|cpc|cpm|email|referral|organic",
    "campaign_format": "{objective}_{audience}_{date:YYMMDD}",
    "content_format": "{ad_id}_{variant}",
    "term_format": "{keyword_or_audience_descriptor}"
  },
  "email_consent_event": {
    "event_name": "email_signup",
    "params": [
      { "name": "source", "type": "string", "required": true },
      { "name": "email_hash", "type": "string", "required": true },
      { "name": "consent_categories_granted", "type": "array", "required": true }
    ],
    "destinations_phase2": ["dest_004"]
  },
  "purchase_event_full_spec": {
    "event_name": "purchase",
    "must_emit_fields": [
      "order_id", "items", "shipping_address",
      "customer_email_hash", "total", "currency",
      "is_first_purchase"
    ]
  },
  "pii_hash_algorithm": "sha256",
  "site_build_writeback": {
    "target_repo_path": "./eec/05-site-build/repo/",
    "files_modified": [
      { "path": ".env.local", "change_type": "env_var_set", "summary": "Set NEXT_PUBLIC_GTM_ID=GTM-XXXXXXX" },
      { "path": "app/layout.tsx", "change_type": "script_inserted", "summary": "Replaced gtm_container_placeholder with real GTM script + consent default block" },
      { "path": "components/ConsentBanner.tsx", "change_type": "config_updated", "summary": "Wired Consent Mode v2 default-denied banner to dataLayer" }
    ],
    "rebuild_required": true,
    "rebuild_executed": true,
    "rebuild_command_run": "pnpm build && pnpm preview",
    "post_rebuild_validation_status": "pass"
  },
  "gtm_container_export_path": "./eec/06-tracking/gtm-container.json",
  "validation_checklist": [
    { "item": "All 13 required events present in events_spec", "status": "pass", "evidence": "schema allOf/contains check passes" },
    { "item": "purchase event emits all 6 H11/H18 fields", "status": "pass", "evidence": "must_emit_fields contains required set" },
    { "item": "Consent Mode v2 defaults all denied for ad_storage and analytics_storage", "status": "pass" },
    { "item": "PII params (customer_email_hash, email_hash) hashed with SHA-256 at runtime", "status": "manual_check_required", "evidence": "Verified in tag config; unit test pending" },
    { "item": "Site rebuild executed and preview reachable", "status": "pass", "evidence": "pnpm preview returned 200 on /" }
  ],
  "meta": {
    "generated_at": "2026-04-21T14:00:00Z",
    "skill_version": "1.0.0",
    "schema_version": "1.0.0",
    "user_input_summary": "Inputs: ./eec/05-site-build/output.json"
  }
}
